{
  "$schema": "../schemas/major-release-terms.schema.json",
  "schema_version": "1.0.0",
  "terms_id": "ct.pentarelease.major.v4.0.0.0.terms",
  "terms_version": "1.0.0",
  "repository": "crownthrive1/CrownThrive-Support",
  "release": {
    "release_class": "major",
    "version": "4.0.0.0",
    "tag": "v4.0.0.0",
    "version_scheme": "crownthrive_extended"
  },
  "content_binding": {
    "mode": "provider_pull_request_head_plus_public_terms_sha256",
    "source_sha_in_terms": false,
    "content_change_after_approval_prohibited": true
  },
  "compatibility_effect": {
    "summary": "CrownThrive OS 4.x replaces the legacy 3.x umbrella release-control contract with exact PR-head lineage, accepted-main merge targeting, append-only publication, and provider readback semantics; independently versioned component contracts and their existing states are not promoted by this OS release.",
    "component_versions_remain_independent": true,
    "component_states_promoted": false
  },
  "institutional_namespaces": {
    "institutional_phase_before": 3,
    "institutional_phase_after": 3,
    "phase_transition_authorized": false,
    "os_release_family_before": "3.x",
    "os_release_family_after": "4.x",
    "os_4x_effective_only_after_v4_provider_readback": true
  },
  "abandoned_candidate": {
    "version": "3.14.0.0",
    "tag": "v3.14.0.0",
    "commit_sha": "ede88f08c3c93eac12adec306811573bfff27a19",
    "branch_ref": "refs/remotes/origin/pentarelease/auto-3.14.0.0-33024509722",
    "state": "ABANDONED_INVALID_LINEAGE_CANDIDATE",
    "provider_tag_observed": false,
    "provider_release_observed": false,
    "branch_and_commit_preserved": true,
    "tag_and_version_reuse_prohibited": true
  },
  "authority_boundaries": {
    "human_founder_only": true,
    "surrogate_used": false,
    "silence_is_authority": false,
    "agent_authority": false,
    "quorum_substitution": false,
    "D3_auto": false,
    "provider_release_creates_authority": false,
    "provider_write_scope_only": true
  },
  "release_scope": {
    "provider_publication_only": true,
    "authority_delegation": false,
    "component_promotion": false
  },
  "artifact_policy": {
    "mode": "governed_package_and_checksums",
    "required_assets": [
      "CrownThrive-OS-v4.0.0.0-package.zip",
      "CrownThrive-OS-v4.0.0.0-package.tar.gz",
      "SHA256SUMS",
      "MANIFEST.json",
      "RELEASE_NOTES.md"
    ]
  },
  "privacy": {
    "public_terms_only": true,
    "chat_transcript_included": false,
    "private_conversation_digest_included": false
  },
  "validity": {
    "requested_at": null,
    "not_before": null,
    "expires_at": null,
    "single_use_nonce": null
  }
}
